{
  "seriesName": "h-008",
  "question": "At what value of injection does the system behavior qualitatively change?",
  "invariants": {
    "dt": 0.12,
    "c_press": 0.1,
    "damping": 0.2,
    "rng_seed": 42
  },
  "injections": [
    {
      "label": "grail",
      "amount": 50
    }
  ],
  "steps": 300,
  "reps": 5,
  "baseline": "fresh",
  "metrics_every": 5,
  "outputs": {
    "summary_csv": true,
    "trace_csv": true,
    "run_bundle_md": true
  },
  "falsifiers": [
    "No transition detected across entire range",
    "Transition is not reproducible across reps"
  ],
  "notes": "",
  "knobs": {
    "injection": [
      0.05,
      0.1,
      0.15,
      0.2,
      0.25,
      0.3,
      0.4,
      0.5
    ]
  }
}